case_id,label,artifact_type,oracle_product,final_status,completeness,correctness,hallucination,accuracy,oracle_grounding,oracle_specificity,precision,recall,false_positive_rate,review_time_reduction_percent
bench-sql-fusion,Fusion SQL Payables Extract,sql,fusion,rejected,56,58,33,44,0,100,33,40,33,94.71
bench-plsql-ebs,EBS Concurrent Program PL/SQL,plsql,ebs,rejected,33,33,100,11,0,100,0,0,100,96.35
bench-groovy-jde,JDE Groovy Orchestration Rule,groovy,jde,rejected,48,58,50,44,0,100,33,40,50,96.13
bench-bip-fusion,Fusion BI Publisher Config,bip,fusion,rejected,52,50,25,33,0,100,25,25,25,94.73
bench-oic-epm,EPM OIC Flow Extract,oic,epm,rejected,48,33,100,11,50,100,0,0,100,96.94
bench-shell-ebs,EBS Shell Deployment Script,script,ebs,rejected,63,55,67,40,0,100,33,33,67,93.66
